{
  "name": "api-docs-generator",
  "displayName": "API Documentation Generator",
  "version": "1.0.0",
  "description": "OpenAPI/Swagger documentation generation and API documentation automation.",
  "author": "jmanhype",
  "license": "MIT",
  "repository": "https://github.com/jmanhype/multi-agent-system",
  "agents": [
    {
      "name": "api-docs",
      "source": "https://raw.githubusercontent.com/jmanhype/multi-agent-system/main/.claude/agents/documentation/api-docs/docs-api-openapi.md",
      "description": "Expert agent for creating and maintaining OpenAPI/Swagger documentation"
    }
  ],
  "tags": ["api", "documentation", "openapi", "swagger", "docs"],
  "category": "documentation",
  "homepage": "https://github.com/jmanhype/multi-agent-system",
  "documentation": "https://github.com/jmanhype/multi-agent-system/blob/main/.claude/agents/documentation/CLAUDE.md"
}
